{
  "id": "security-txt-bug-bounty-value",
  "title": "Bug-Bounty, when present, must be True or False",
  "artifact": "security.txt",
  "rule_class": "convention",
  "severity": "fail",
  "rationale": "Bug-Bounty is not an RFC 9116 field. The IANA \"security.txt Fields\" registry (https://www.iana.org/assignments/security-txt-fields/security-txt-fields.xml, retrieved 2026-10-29, sha256 cb20345da903627c9761a77f72f19f57f8cd837a9e483381d076a45b7640f120) registered it on 2026-03-07 with this description: \"A project or company that may financially reward reporters via a bug bounty program as per section 3.5.5 of [CERT.CVD] can indicate this by adding the line \\\"Bug-Bounty: True\\\". Adding the line \\\"Bug-Bounty: False\\\" indicates that no financial reward via a bug bounty program can be offered.\" The registry defines two values and no others. It is a living page, not one of the immutable sources rule.schema.json admits as pinnedAt, so this rule cannot carry a conformance citation; the description is recorded here instead.",
  "derivedFrom": {
    "source": "IANA security.txt Fields registry",
    "clause": "Bug-Bounty (record dated 2026-03-07)",
    "url": "https://www.iana.org/assignments/security-txt-fields/security-txt-fields.xml",
    "version": "registry last updated 2026-03-07"
  },
  "policy_note": "The match is exact and case-sensitive: the registry spells the two lines 'Bug-Bounty: True' and 'Bug-Bounty: False', and nothing in RFC 9116 or the registry makes a field VALUE case-insensitive (RFC 9116 §2 folds only field NAMES). Every Bug-Bounty value is checked.",
  "applicability": "A security.txt body with at least one non-empty Bug-Bounty value. The field is optional.",
  "expectation": "Every Bug-Bounty value is exactly True or False.",
  "cases": [
    {
      "name": "Bug-Bounty: yes",
      "outcome": "failed",
      "input_file": "cases/bug-bounty-invalid.txt",
      "input_kind": "text",
      "now": "2026-07-16T00:00:00.000Z",
      "expect": [
        {
          "id": "security-txt-bug-bounty-value",
          "severity": "fail"
        }
      ]
    },
    {
      "name": "Bug-Bounty: false -- lowercase is not a registered value",
      "outcome": "failed",
      "input_file": "cases/bug-bounty-lowercase.txt",
      "input_kind": "text",
      "now": "2026-07-16T00:00:00.000Z",
      "expect": [
        {
          "id": "security-txt-bug-bounty-value",
          "severity": "fail"
        }
      ]
    },
    {
      "name": "Bug-Bounty: True",
      "outcome": "passed",
      "input_file": "cases/bug-bounty-true.txt",
      "input_kind": "text",
      "now": "2026-07-16T00:00:00.000Z",
      "expect": []
    },
    {
      "name": "Bug-Bounty: False",
      "outcome": "passed",
      "input_file": "cases/bug-bounty-false.txt",
      "input_kind": "text",
      "now": "2026-07-16T00:00:00.000Z",
      "expect": []
    },
    {
      "name": "no Bug-Bounty field -- the field is optional",
      "outcome": "inapplicable",
      "input_file": "cases/valid.txt",
      "input_kind": "text",
      "now": "2026-07-16T00:00:00.000Z",
      "expect": []
    }
  ]
}
